index,name,score,dtm,text,app_name,text_length
14849,YU-JU CHOU (小周),1 顆星,2022年3月15日,更新後開不起來，希望重裝有用,元大銀行 Yuanta Commercial Bank,14
29562,四腳（四腳）,4 顆星,2022年11月30日,為何帳務出入通知不見了！,將來銀行 NEXT BANK,12
28951,Marco Chen,2 顆星,2023年8月16日,每用一次都跳除要求評分 太煩了,DBS digibank TW 星展行動銀行,15
16310,carol hung,5 顆星,2024年2月7日,在帳戶轉換時會卡卡的。,永豐行動銀行,11
14717,張柏林,1 顆星,2022年7月5日,請問為何下載後無法開啟app？,元大銀行 Yuanta Commercial Bank,15
9247,Cathy Wu,4 顆星,2024年3月21日,用起來挺順的，就是醜了點。,富邦行動銀行,13
9208,་ཀྱི་ཨང་དང་པོ། ང་ནི་འཛམ་གླིང་ཡོངས,5 顆星,2024年4月2日,更新了還是進不去,富邦行動銀行,8
7294,包隆豪,1 顆星,2022年5月8日,有夠麻煩、難用！,中國信託行動銀行 Home Bank,8
8181,Ching EN Huang,4 顆星,2022年3月14日,一直無法更新!!!,中國信託行動銀行 Home Bank,9
27626,HAU,1 顆星,2022年10月7日,一直當機 也太爛了吧？,新光銀行,11
8031,李花兒,1 顆星,2022年3月16日,無法正常更新，程式一直在轉,中國信託行動銀行 Home Bank,13
15668,James Chang,3 顆星,2022年3月14日,為什麼一直轉圈圈無法更新,第一銀行 第e行動,12
25267,洪聖皓,5 顆星,2023年8月6日,簡單操作，方便又迅速,Richart,10
17779,savon savon,1 顆星,2021年7月9日,更新後無法使用快速登入,永豐行動銀行,11
8745,謝秀蘭,5 顆星,2022年2月14日,很簡單 ，安全 ，方便,中國信託行動銀行 Home Bank,11
13748,Yu Ting,1 顆星,2022年1月2日,無限循環的更新+當機,兆豐銀行,10
8050,MARS MARS,5 顆星,2022年3月15日,更新版本變超慢的……完全不好用,中國信託行動銀行 Home Bank,15
27334,謝侑庭,1 顆星,2023年9月17日,改版後使用上一直卡住！到底,新光銀行,13
11504,Wendy H,3 顆星,2023年5月1日,三不五時就網銀登入失敗，爛爆,富邦行動銀行,14
9944,陳瑞婷,5 顆星,2023年9月1日,很棒，簡單好操作,富邦行動銀行,8
19938,施寶珍,5 顆星,2023年7月23日,謝謝玉山銀行真方便,玉山行動銀行,9
12517,bubufamily Su,5 顆星,2022年5月4日,nice app! 👍,富邦行動銀行,11
10736,花惹發,1 顆星,2023年7月15日,商店不給更新阿！,富邦行動銀行,8
9928,fish Fan,4 顆星,2023年9月5日,最近蠻順的~~~,富邦行動銀行,8
27596,融Neil,1 顆星,2022年10月10日,到底要修復了沒啊？,新光銀行,9
27341,licheng zheng,1 顆星,2023年9月16日,變成這個版本後連轉帳都無法使用,新光銀行,15
889,乾（水牛）,5 顆星,2023年8月7日,操作簡易 輕鬆上手,國泰世華網路銀行CUBE,9
25300,sara_pp sara_pp,1 顆星,2023年8月5日,一直閃退 原本比較好用,Richart,11
18076,劉彥岑,3 顆星,2024年1月13日,更新後台灣pay付款碼無法使用,華南銀行+,15
26660,翁維德,5 顆星,2021年10月13日,好用操作方便的程式。,Richart,10
29005,Madrid Ma,1 顆星,2023年8月12日,都一直無法下載，好誇張,DBS digibank TW 星展行動銀行,11
10746,劉林,1 顆星,2023年7月15日,強制更新後却無法開啓使用,富邦行動銀行,12
15230,蕭幸汝,1 顆星,2023年11月18日,無法登入，無法查詢餘額,第一銀行 第e行動,11
103,Js Lin,5 顆星,2024年3月4日,"。.. ._.。。..,",國泰世華網路銀行CUBE,12
27978,平小靜,1 顆星,2023年10月5日,一直轉圈圈，無法開啟APP,LINE Bank,13
23966,智誠張,5 顆星,2022年3月31日,速度快～方便好用,台新銀行行動銀行,8
29592,Wendy,5 顆星,2022年11月13日,歡迎使用 FAE2C,將來銀行 NEXT BANK,10
26056,lotus Tang,5 顆星,2022年4月15日,方便快速的app,Richart,8
12429,李恩盛,5 顆星,2022年5月28日,不錯 很好用的程式,富邦行動銀行,9
24796,李珊珊,3 顆星,2023年12月15日,明細最下面會被選項鍵擋住,Richart,12
18357,Ting Fan,1 顆星,2023年10月16日,爛！好少公司搭配.,華南銀行+,9
21169,WADE BLUE,2 顆星,2022年3月11日,快速登錄經常卡住，卡老半天,玉山行動銀行,13
4842,楊云霏,2 顆星,2023年11月10日,為什麼這幾天APP很不穩定,中國信託行動銀行 Home Bank,13
10356,邱湘芷,1 顆星,2023年7月15日,根本打不開也無法更新,富邦行動銀行,10
30011,Jason Chien,5 顆星,2022年4月2日,推薦碼自取 7YZHQ,將來銀行 NEXT BANK,11
9989,Arvr Vix,5 顆星,2023年8月17日,速度快，介面好用,富邦行動銀行,8
16490,張順程,5 顆星,2023年11月6日,永豐銀行真的很棒！,永豐行動銀行,9
2409,吳美蓉,4 顆星,2022年9月19日,不錯用，很方便效率很快喔,國泰世華網路銀行CUBE,12
18596,謝智淵（小謝哥）,1 顆星,2023年1月5日,大半夜網路銀行壞掉是什麼樣,華南銀行+,13
3239,葉偉正,5 顆星,2022年4月15日,換匯快速，簡單，易懂,國泰世華網路銀行CUBE,10
15118,明杰,1 顆星,2021年10月29日,無法開啟，無法更新，怎麼回事,元大銀行 Yuanta Commercial Bank,14
6289,張麗美,1 顆星,2022年11月5日,紓困分期繳費路徑不清楚,中國信託行動銀行 Home Bank,11
11094,唐語芯,1 顆星,2023年7月14日,更新完就打不開了,富邦行動銀行,8
21893,江傑克,1 顆星,2023年5月25日,每次設定好就莫名跳掉，,合作金庫銀行,11
13344,曾稚婷,5 顆星,2023年10月24日,真的很方便、好用,兆豐銀行,8
20142,maggie Liu,5 顆星,2023年6月3日,穩定可靠app及值得信賴銀行,玉山行動銀行,14
2473,莊啟仲,5 顆星,2022年9月5日,哈利路亞以馬內利阿們。,國泰世華網路銀行CUBE,11
10637,陳界宏,1 顆星,2023年7月15日,連更新都無法，請快點處理,富邦行動銀行,12
9488,Fanghui hu,5 顆星,2024年1月1日,方便查詢帳戶資料,富邦行動銀行,8
15988,鄭貴雄,1 顆星,2021年11月7日,請問一下我的為什麼不能轉帳呢,第一銀行 第e行動,14
4238,陳書欣,1 顆星,2021年12月21日,為何一定要更新 更新又跑不動😡,國泰世華網路銀行CUBE,15
3735,劉致毅,5 顆星,2022年2月21日,簡單快速又方便的APP,國泰世華網路銀行CUBE,11
9297,Bruin Lee,5 顆星,2024年3月2日,反應已更新。讚！,富邦行動銀行,8
21494,李臻,3 顆星,2021年11月20日,帳戶異動推播聲音都不通知了,玉山行動銀行,13
14755,王Susu,1 顆星,2022年6月13日,真的很難上，好無奈,元大銀行 Yuanta Commercial Bank,9
26441,俐依陳,5 顆星,2021年12月24日,希望能有人讓我介紹,Richart,9
26583,Fairy Lui,5 顆星,2021年11月12日,介面可愛又好用！,Richart,8
16216,Wei Chen,1 顆星,2024年3月29日,一直顯示網路連線異常，無法登入,永豐行動銀行,15
26691,黃智偉,1 顆星,2024年4月1日,掛掉了嗎？ 連不上線,新光銀行,10
14634,楊一惠,1 顆星,2022年8月6日,自從更新後，就無法再進入了,元大銀行 Yuanta Commercial Bank,13
6741,yung ming yang,5 顆星,2022年8月10日,簡易明瞭容易操作,中國信託行動銀行 Home Bank,8
3973,蘇煒庭,5 顆星,2022年1月19日,非常方便，不用擔心繳費過期,國泰世華網路銀行CUBE,13
6840,Elvis Hu,3 顆星,2022年7月23日,Widgets4＊2無法顯示,中國信託行動銀行 Home Bank,14
8156,Allen Shieh,1 顆星,2022年3月14日,沒法download,中國信託行動銀行 Home Bank,10
8343,甘沅右,4 顆星,2022年3月12日,一直要我重新更新,中國信託行動銀行 Home Bank,8
21315,就說實話,1 顆星,2022年2月9日,一直開不了，要重新安裝才能,玉山行動銀行,13
31002,Miranda Liu,1 顆星,2022年8月3日,無法登入 破爛app,臺灣銀行-網路銀行隨身版,10
29786,艾琉拉,1 顆星,2022年7月5日,一天到晚確認網路狀況……,將來銀行 NEXT BANK,12
11928,Yan-Shen Huang,5 顆星,2022年11月3日,Excellent,富邦行動銀行,9
22184,洪芷芸,1 顆星,2022年3月29日,一直更新失敗 也不知道原因,合作金庫銀行,13
7132,阿翔,5 顆星,2022年6月7日,使用上還不錯的app,中國信託行動銀行 Home Bank,10
461,Jung Yeh,1 顆星,2023年12月14日,更新後一直閃退進不去，到底？,國泰世華網路銀行CUBE,14
2336,千本,4 顆星,2022年10月4日,難以查帳不如從前,國泰世華網路銀行CUBE,8
18284,朱宇凡,5 顆星,2023年12月28日,簡單好操作，投資好幫手,華南銀行+,11
28463,淑資,2 顆星,2022年4月15日,常無法開啟很困擾,LINE Bank,8
28783,黃琮暉,1 顆星,2024年2月27日,爛銀行，爛app,DBS digibank TW 星展行動銀行,8
25229,陳睿捷,5 顆星,2023年8月8日,"操作界面非常人性化 ,好用.",Richart,14
23166,Tina Chung,5 顆星,2022年10月7日,終於改了，耳目一新,凱基銀行,9
19552,Elsa.lu Chen,1 顆星,2023年11月9日,都會扣手續費 真是爛,玉山行動銀行,10
11506,YY hsu,5 顆星,2023年5月1日,程式設計的不錯，方便易懂,富邦行動銀行,12
14645,黃上,1 顆星,2022年8月5日,更新你的頭幹害我又要重載,元大銀行 Yuanta Commercial Bank,12
6709,Sabrina1968 Lin,5 顆星,2022年8月17日,功能服務人性化簡便,中國信託行動銀行 Home Bank,9
16505,Mark,5 顆星,2023年11月1日,操作方便介面簡潔,永豐行動銀行,8
11911,Eddie M.H,5 顆星,2022年11月10日,使用上很直覺，很不錯,富邦行動銀行,10
447,鄭珊珊,5 顆星,2023年12月18日,很多功能都整合的很方便,國泰世華網路銀行CUBE,11
19457,陳惠芳,5 顆星,2023年12月5日,第一次使用，很快就完成了！,玉山行動銀行,13
15028,Anita Lin,1 顆星,2021年12月6日,今天更新後再也進不去了……傻眼,元大銀行 Yuanta Commercial Bank,15
25190,jessicarabbit,1 顆星,2023年8月10日,改啥版啦很難用欸,Richart,8
21141,李Jeff,5 顆星,2022年3月23日,非常方便使用！很棒！,玉山行動銀行,10
11042,Chungyi Kuo,3 顆星,2023年7月14日,只說要更新但又不給我更新檔,富邦行動銀行,13
29371,盛寶陞,4 顆星,2023年6月18日,希望能早日加入集保開放銀行,將來銀行 NEXT BANK,13
3275,蔡明璋,1 顆星,2022年4月9日,一直處於叫我更新,國泰世華網路銀行CUBE,8
3716,陳振文,5 顆星,2022年2月23日,"便利,還不錯使用",國泰世華網路銀行CUBE,8
27972,陳瑞忠,1 顆星,2023年10月16日,Android 14 會閃退,LINE Bank,14
9662,陳佑昇,1 顆星,2023年11月11日,都還沒使用到一直跳評分,富邦行動銀行,11
11647,veronika Lee,5 顆星,2023年3月20日,介面很清楚，方便使用,富邦行動銀行,10
28095,YongZhi Lin,1 顆星,2023年4月18日,要轉圈圈轉多久？,LINE Bank,8
5809,D.C. W.,5 顆星,2023年2月23日,方便，人性化，步驟不馬虎,中國信託行動銀行 Home Bank,12
16058,恭欽王,3 顆星,2021年9月22日,更改個資電話不方便,第一銀行 第e行動,9
9029,Wei Han Wu (Wilma),5 顆星,2022年1月8日,問題已解決，謝謝~,中國信託行動銀行 Home Bank,9
18802,林建宏,1 顆星,2022年10月5日,有夠爛的APP，常當機！,華南銀行+,12
17373,Ching-Yi YEH (poesid),1 顆星,2022年3月22日,為什麼顯示偵測到非官方授權,永豐行動銀行,13
27818,松井秀喜,1 顆星,2022年1月3日,從早上更新到下午就是更新不了,新光銀行,14
15459,陳沛尹,1 顆星,2022年9月3日,為何無法更新，無法使用,第一銀行 第e行動,11
15632,Libra Yang,1 顆星,2022年4月17日,終於找到比花旗更爛的app,第一銀行 第e行動,13
29670,A T,1 顆星,2022年9月20日,動不動就卡住沒回應 超級糟糕,將來銀行 NEXT BANK,14
11760,Coco,1 顆星,2023年1月29日,指紋一直卡住沒辦法用，不方便,富邦行動銀行,14
23864,張博堯,1 顆星,2022年4月12日,這app怎麼越來越慢,台新銀行行動銀行,10
30462,吳佳明,5 顆星,2022年8月22日,很棒的銀行，活存高利不限金額,樂天國際商業銀行,14
14710,蕭天竣,1 顆星,2022年7月12日,超級難用更新後打不開,元大銀行 Yuanta Commercial Bank,10
539,魏惠珍,1 顆星,2023年11月28日,"每次都登記,這幾次有誤!",國泰世華網路銀行CUBE,12
31419,陳芊卉,1 顆星,2021年10月5日,非常難用，一直當,臺灣銀行-網路銀行隨身版,8
6170,YuFan,1 顆星,2022年11月28日,一開就卡 到底怎麼用？？,中國信託行動銀行 Home Bank,12
11636,SAGA,1 顆星,2023年3月24日,不能快速登入，不好用浪費時間!,富邦行動銀行,15
13725,Rainanddew,1 顆星,2022年1月12日,有夠爛，常常卡住,兆豐銀行,8
2157,C.T.P,2 顆星,2022年11月4日,信用卡額度為負向是要怎麼看,國泰世華網路銀行CUBE,13
13954,安安,3 顆星,2021年9月15日,一天到晚要常常更新，很累人,兆豐銀行,13
29389,Andrew,5 顆星,2023年5月7日,K9JGM 我的邀請碼，感謝,將來銀行 NEXT BANK,14
16274,慶,1 顆星,2024年3月7日,查明細一直轉圈圈,永豐行動銀行,8
30809,Vicky,1 顆星,2023年5月23日,突然又無法點開匯率跟黃金存摺,臺灣銀行-網路銀行隨身版,14
28178,冀小棠,2 顆星,2023年1月2日,這幾天很卡，一直登不上。,LINE Bank,12
22229,吳達方,1 顆星,2022年1月20日,超難用，限制一堆，爛,合作金庫銀行,10
8847,Wei大妞,1 顆星,2022年1月24日,舊的好用丫。更新成這啥？,中國信託行動銀行 Home Bank,12
6153,莊富程,5 顆星,2022年12月1日,好用，操作頁面直覺,中國信託行動銀行 Home Bank,9
21802,Moon Ann,1 顆星,2023年11月23日,最難用，沒有之一,合作金庫銀行,8
22945,侯志正,2 顆星,2022年11月10日,好容易當，當掉後全部要重来，,凱基銀行,14
31283,cocoa,1 顆星,2022年3月6日,轉帳怎麼掛了，空白一片,臺灣銀行-網路銀行隨身版,11
10078,ting chen,5 顆星,2023年8月1日,介面清楚完整好用，功能很完善,富邦行動銀行,14
1568,張銓薈,5 顆星,2023年2月1日,使用便利，福利很多,國泰世華網路銀行CUBE,9
28201,Taco Chen,3 顆星,2022年12月4日,用line開啟一直閃退,LINE Bank,11
16142,陳宏運,1 顆星,2021年9月11日,無法安裝也無法更新,第一銀行 第e行動,9
311,Manchester Stephen,1 顆星,2024年1月13日,X100 Pro 瘋狂閃退,國泰世華網路銀行CUBE,13
7558,Sean Yang,4 顆星,2022年4月10日,介面清新，但操作反應稍慢,中國信託行動銀行 Home Bank,12
22014,吳致宣,1 顆星,2022年11月8日,權限都允許了，怎麼就閃退了,合作金庫銀行,13
15776,楊復智,1 顆星,2022年1月23日,無法 下載 無言,第一銀行 第e行動,8
16492,蔡伯勳,5 顆星,2023年11月6日,方便、信任、清楚,永豐行動銀行,8
28377,貓貓,5 顆星,2022年6月23日,轉帳免手續費很好用,LINE Bank,9
6295,詹宏偉,5 顆星,2022年11月4日,好用，提醒很多很簡要,中國信託行動銀行 Home Bank,10
12457,Yu Laura,1 顆星,2022年5月19日,為何沒法登入呢？,富邦行動銀行,8
4660,YuanTai,5 顆星,2023年12月24日,簡單 直覺 易用,中國信託行動銀行 Home Bank,8
27641,Ying-chen Lai,1 顆星,2022年10月1日,銀行app整個無法顯示資料,新光銀行,13
16266,蔡本慧,1 顆星,2024年3月10日,密碼連結可以簡化,永豐行動銀行,8
7120,余淑芳,5 顆星,2022年6月10日,很有效率的App,中國信託行動銀行 Home Bank,8
6415,Chung Samantha,5 顆星,2022年10月8日,轉帳交易安全放心的好app,中國信託行動銀行 Home Bank,13
10723,小匿名,2 顆星,2023年7月15日,銀行自動憑證更新後無法使用,富邦行動銀行,13
29648,朱自清,3 顆星,2022年10月5日,？！！ㄞˊㄔㄗㄗㄐㄑㄧㄛ,將來銀行 NEXT BANK,12
16881,王建博,5 顆星,2023年4月27日,速度很快，介面很戀愛，很讚,永豐行動銀行,13
28072,BOHA Wu,1 顆星,2023年5月23日,開不起來 很火大,LINE Bank,8
30095,張家琪,5 顆星,2024年2月18日,好用的網銀，操作簡單不複雜,樂天國際商業銀行,13
26317,洪藝嘉,5 顆星,2022年1月24日,介面易懂，方便使用,Richart,9
3130,Lousia L,1 顆星,2022年5月6日,超爛的銀行 app,國泰世華網路銀行CUBE,9
1391,余素惠,5 顆星,2023年3月10日,警衛人員服務親切,國泰世華網路銀行CUBE,8
21652,Chenchen Chen,3 顆星,2021年10月14日,"新版本,一直安全連線,沒法進入",玉山行動銀行,15
464,陳玟妙,3 顆星,2023年12月14日,一直無法登錄 是怎麼？,國泰世華網路銀行CUBE,11
30973,波奇大人,2 顆星,2022年8月19日,It sucks,臺灣銀行-網路銀行隨身版,8
15078,詠絜龔（丸子）,4 顆星,2021年11月26日,若能簡化登入流程會更便利！,元大銀行 Yuanta Commercial Bank,13
19976,吳易凡,5 顆星,2023年7月10日,勉強好用，更改密碼的地方很難找,玉山行動銀行,15
27912,張嘉倫,1 顆星,2023年12月21日,超級難用…驗證的部分也很不友善,LINE Bank,15
20529,王建祥,1 顆星,2022年9月29日,現在轉賬都轉不出去,玉山行動銀行,9
23159,Ace Jang,5 顆星,2022年10月14日,很好用！ 字小了點,凱基銀行,9
21553,陳世倫,1 顆星,2021年11月1日,安裝都裝不了了 哪招,玉山行動銀行,10
9657,Nica LIN,5 顆星,2023年11月14日,很視覺化，很方便使用,富邦行動銀行,10
2398,Yupin S.,5 顆星,2022年9月21日,介面總算統一了，好看給5星,國泰世華網路銀行CUBE,13
23351,仲兪樂,5 顆星,2023年7月2日,嚴防個人資料法。,台新銀行行動銀行,8
16760,May T,5 顆星,2023年6月25日,十分方便，功能按鍵設計清晰,永豐行動銀行,13
2198,張hsiufon,5 顆星,2022年10月25日,方便快速，能立即解決客戶問題,國泰世華網路銀行CUBE,14
15504,林平芝,1 顆星,2022年8月10日,我人生第一個一星就這樣送給你,第一銀行 第e行動,14
25427,藍色天空,1 顆星,2023年6月10日,你們app 故障了 登不進去,Richart,14
31182,鄭傑丞,1 顆星,2022年5月24日,使用很不直覺，頁面轉換手續繁雜,臺灣銀行-網路銀行隨身版,15
17190,philip wu,4 顆星,2022年12月9日,Great to use !,永豐行動銀行,14
29366,李雲霆,5 顆星,2023年6月28日,推薦碼 X896S,將來銀行 NEXT BANK,9
16589,彭永佳,1 顆星,2023年9月13日,約定帳戶轉帳要手續費,永豐行動銀行,10
29545,fengchuan cho,4 顆星,2022年12月13日,體驗便利，可靈活運用,將來銀行 NEXT BANK,10
9142,黃建霖,2 顆星,2021年12月30日,帳戶有疑問根本無法當下排除,中國信託行動銀行 Home Bank,13
25576,蕭孟楠,5 顆星,2023年2月16日,很好操控。簡單。很不錯,Richart,11
10941,亞路莎,1 顆星,2023年7月14日,就沒得更新，還要更新，爛,富邦行動銀行,12
181,李阿濱,1 顆星,2024年2月18日,vivo手機更新後閃退狀況,國泰世華網路銀行CUBE,13
2773,王瀞鈺,2 顆星,2022年7月19日,不更新不能轉賬真的好爛,國泰世華網路銀行CUBE,11
26138,cora,3 顆星,2022年3月24日,無法下載，但不更新又不給用,Richart,13
21919,林小淯,2 顆星,2023年4月10日,設定為神麼入帳都沒有通知呢,合作金庫銀行,13
30300,張子清,5 顆星,2023年4月11日,方便使用 快速便捷,樂天國際商業銀行,9
8573,陳永華,1 顆星,2022年3月12日,一直無法進入要請更新,中國信託行動銀行 Home Bank,10
28398,邱垂勳,1 顆星,2022年6月6日,指紋辨識會反白，無法登入,LINE Bank,12
10124,林琪淑,5 顆星,2023年7月19日,富邦銀行操作簡易方便喔！,富邦行動銀行,12
29207,Jack Chen,5 顆星,2021年6月25日,持續改進，值得鼓勵,DBS digibank TW 星展行動銀行,9
25631,kuo kuo,1 顆星,2023年1月6日,到底瘋狂更新個鬼？,Richart,9
11982,CHIA-CHI YEN,5 顆星,2022年10月5日,目前為止轉帳都還算穩定，讚,富邦行動銀行,13
744,趙家樑,1 顆星,2023年9月18日,不更新，就沒消費通知，有夠爛！,國泰世華網路銀行CUBE,15
20062,周明艷,5 顆星,2023年6月15日,清楚快速，使用方便。,玉山行動銀行,10
29944,黃致堯,4 顆星,2022年4月15日,請開放螢幕截圖的功能開關,將來銀行 NEXT BANK,12
7885,李孟燕,1 顆星,2022年3月21日,更新無法更新，刪除後又無法下載,中國信託行動銀行 Home Bank,15
26851,Tsan W,5 顆星,2023年11月26日,喜歡新功能和新介面,新光銀行,9
22595,ning,1 顆星,2020年8月26日,為什麼突然不能指紋登入了？,合作金庫銀行,13
2128,maggie liu,5 顆星,2022年11月9日,很方便可以繳很多的帳單,國泰世華網路銀行CUBE,11
22592,梁釺憶,1 顆星,2020年8月30日,我才用沒2次就被鎖密了，爛透了,合作金庫銀行,15
21304,Kevin H,3 顆星,2022年2月10日,App 不能做定存？,玉山行動銀行,10
1340,羅文孝,5 顆星,2023年3月22日,很先進的銀行APP！,國泰世華網路銀行CUBE,10
14122,鄒小鄒,1 顆星,2024年3月11日,今天很卡是在卡幾點,元大銀行 Yuanta Commercial Bank,9
23087,夏一平,1 顆星,2022年10月24日,超級爛，難用的爆,凱基銀行,8
20169,Ken Huang,5 顆星,2023年6月1日,最喜歡哪個零錢掉落聲😍,玉山行動銀行,11
19158,羅仕沐,4 顆星,2024年3月7日,系統方便多元，便利使用,玉山行動銀行,11
10850,Hoy Fu,2 顆星,2023年7月15日,請問要從哪裡更新憑證？,富邦行動銀行,11
20049,施量擷,5 顆星,2023年6月19日,十分方便，介面也很易懂，感恩,玉山行動銀行,14
9971,PEIYUN CHENG,5 顆星,2023年8月24日,實用 查詢也方便,富邦行動銀行,8
10676,阿文,4 顆星,2023年7月15日,為什麼我不能更新？,富邦行動銀行,9
16362,6300244,1 顆星,2024年1月6日,一直顯示系統忙線中，爛。,永豐行動銀行,12
10950,林毓禎,4 顆星,2023年7月14日,7/15更新後無法開啟,富邦行動銀行,11
18070,柳志宏,5 顆星,2024年1月15日,很方便，操作簡單,華南銀行+,8
20034,Addiso Addison_,5 顆星,2023年6月22日,還不錯用哦！ 謝謝！,玉山行動銀行,10
10136,Jason hsu,5 顆星,2023年7月17日,讚💯💖💯👍💕👍💯,富邦行動銀行,8
17608,陳安,1 顆星,2021年11月24日,已經更新了還是打不開,永豐行動銀行,10
9271,翁崇賀,5 顆星,2024年3月8日,簡介簡單清楚明瞭，好操作,富邦行動銀行,12
10558,show fun lu,1 顆星,2023年7月15日,很難用，簡直是鬼打牆,富邦行動銀行,10
28235,面對,1 顆星,2022年10月1日,裡面沒有錢，錢多的可以轉給我,LINE Bank,14
13445,孫朝裕,1 顆星,2023年5月14日,所有下滑全壞 無法手機查賬,兆豐銀行,13
30135,Lin Darren,1 顆星,2024年1月20日,跟本打不開，爛透了,樂天國際商業銀行,9
17120,KAYAK CHEN,5 顆星,2023年1月5日,方便、明確、簡單,永豐行動銀行,8
21532,Wylla,5 顆星,2021年11月7日,好用，版面簡單明瞭,玉山行動銀行,9
11277,邵敏英，Nicky3305@Gmail.com,5 顆星,2023年7月4日,無障礙的使用，很順暢,富邦行動銀行,10
19380,day happy,5 顆星,2024年1月3日,2aTGRKAV,玉山行動銀行,8
5321,詹益凱,5 顆星,2023年7月7日,清楚，一看就懂。,中國信託行動銀行 Home Bank,8
13469,陳X玲,1 顆星,2023年2月21日,為什麼不能快速瀏覽帳戶餘額?,兆豐銀行,14
17653,shuhua Cheng,1 顆星,2021年11月6日,更新之後登入爆慢，甚至無法登入,永豐行動銀行,15
7313,許家榛,4 顆星,2022年5月5日,so great 👍,中國信託行動銀行 Home Bank,10
12645,謝騏羽,5 顆星,2022年4月2日,非常不錯用的系統,富邦行動銀行,8
29284,Shenny TV,1 顆星,2024年1月9日,都已經重安裝了 還一直叫我更新,將來銀行 NEXT BANK,15
2177,Michelle C,1 顆星,2022年10月31日,視訊很難用，根本不能辨識,國泰世華網路銀行CUBE,12
12960,LIV CHOU,1 顆星,2022年1月7日,一直說沒網路，但我明明有,富邦行動銀行,12
16013,Poddy RD,1 顆星,2021年10月13日,無法更新，砍掉重新下載也不行,第一銀行 第e行動,14
23802,羽忻蘇,1 顆星,2022年5月28日,為什麼無法開啟App,台新銀行行動銀行,10
8123,林岱琪,1 顆星,2022年3月14日,無法更新啊！請問如何查帳,中國信託行動銀行 Home Bank,12
17554,林國樑,1 顆星,2021年11月25日,常常更新，浪費時間,永豐行動銀行,9
23739,吳育任,1 顆星,2022年7月20日,太爛了，更新一直在轉,台新銀行行動銀行,10
27729,Andy Chang,5 顆星,2022年6月28日,方便好用，簡單又容易上手👍,新光銀行,13
24839,PLUS蕭,5 顆星,2023年12月6日,每月免費跨轉，讓用戶更方便,Richart,13
847,CHEN WISH,1 顆星,2023年8月17日,UI規劃不流暢，難用,國泰世華網路銀行CUBE,10
2030,柴柴愛運動 Shiba Inu,1 顆星,2022年12月1日,更新完，錯誤頻繁,國泰世華網路銀行CUBE,8
30201,劉政宏,5 顆星,2023年9月10日,好用，會推鑑給親友。,樂天國際商業銀行,10
481,Allen Lai,5 顆星,2023年12月11日,又不能用，是嫌被罰不夠？,國泰世華網路銀行CUBE,12
20783,くぎさきコンパス,1 顆星,2022年7月11日,更新每次都有問題,玉山行動銀行,8
20183,Peter Lai,5 顆星,2023年5月31日,使用很方便，介面也很簡潔,玉山行動銀行,12
22483,abb Eige,1 顆星,2021年1月18日,沒什麼用因為轉帳限制太多,合作金庫銀行,12
13322,愁雲,1 顆星,2023年11月21日,很難用，無法登入,兆豐銀行,8
5892,Lamb,1 顆星,2023年2月8日,註冊會員永遠都是錯誤代碼是怎樣,中國信託行動銀行 Home Bank,15
1640,星詠の吹吉拉,1 顆星,2023年1月19日,有夠爛，繳費方式少的可憐,國泰世華網路銀行CUBE,12
20614,林林,4 顆星,2022年8月31日,請問還有指紋辨識嗎..,玉山行動銀行,11
18893,張阿順,5 顆星,2022年9月5日,方便 快速 簡單 好用,華南銀行+,11
22698,張先生（張某）,1 顆星,2024年2月4日,無法在週日使用優利定存服務。,凱基銀行,14
4581,蕭 HSIAO偉榮 Wei jung,5 顆星,2024年1月18日,很值得推薦的系統，快速又安全。,中國信託行動銀行 Home Bank,15
29690,楊先生,2 顆星,2022年9月1日,跑太快点，我跟不上,將來銀行 NEXT BANK,9
