index,name,score,dtm,text,app_name,text_length
25350,Hao (Hao),1 顆星,2023年8月2日,亂改什麼介面，原本好好的,Richart,12
20541,郭小春,1 顆星,2022年9月24日,APP太耗電了，已刪,玉山行動銀行,10
14024,鄭昭華,2 顆星,2021年7月17日,請問信用卡功能怎麼不能用了？,兆豐銀行,14
359,李雅燕,2 顆星,2024年1月5日,怎麼現在要收轉帳手續費了,國泰世華網路銀行CUBE,12
8337,Yes Yu,5 顆星,2022年3月12日,好用的下載後為何要立即更新,中國信託行動銀行 Home Bank,13
26686,吳安彬,5 顆星,2021年9月30日,使用起來快速方便又順手，讚。,Richart,14
5967,葉宗鳴,5 顆星,2023年1月12日,銀行就是要有誠信,中國信託行動銀行 Home Bank,8
22524,江富笙,1 顆星,2020年11月10日,一直出現系統錯誤，無法登入,合作金庫銀行,13
16192,喬士哲,5 顆星,2021年9月10日,好用 沒什麼問題,第一銀行 第e行動,8
31374,珮伶黃,1 顆星,2021年10月20日,完全不能更新也登不了,臺灣銀行-網路銀行隨身版,10
14907,崧欸,1 顆星,2022年2月25日,登不進去是在耍我嗎,元大銀行 Yuanta Commercial Bank,9
3321,郭昱秀（Rachel Kuo）,5 顆星,2022年4月6日,方便快速，系統也簡單明瞭好使用,國泰世華網路銀行CUBE,15
8151,李雨樺,1 顆星,2022年3月14日,根本就不能更新啊！,中國信託行動銀行 Home Bank,9
25908,Victor Pon,4 顆星,2022年7月12日,還可以，跟國外用的差不多，,Richart,13
23353,Moore Wang,1 顆星,2023年6月30日,圖型登入一直有問題,台新銀行行動銀行,9
12013,龍姬雪美,1 顆星,2022年9月12日,有夠難用，根本登不進去,富邦行動銀行,11
8236,Lisa Chang Lo,5 顆星,2022年3月13日,很流暢，快速安全,中國信託行動銀行 Home Bank,8
6853,紀景彬,5 顆星,2022年7月21日,非常的好用 讚喔~,中國信託行動銀行 Home Bank,9
1097,莊英順,5 顆星,2023年5月25日,操作簡單方便快速,國泰世華網路銀行CUBE,8
3761,何清江,5 顆星,2022年2月16日,比使用現金方便攜帶方便,國泰世華網路銀行CUBE,11
19831,胡鎮琮,2 顆星,2023年8月20日,強迫更新卻又不會自動跳轉,玉山行動銀行,12
7267,jamesvj330,5 顆星,2022年5月11日,good job,中國信託行動銀行 Home Bank,8
11315,經經,5 顆星,2023年6月22日,介面不難尋找，容易操作！,富邦行動銀行,12
24575,蓉緻,1 顆星,2024年3月21日,無法下載更新新版程式,Richart,10
14763,Rex Chen,2 顆星,2022年5月25日,好慘，進不去怎麼交割...,元大銀行 Yuanta Commercial Bank,13
8835,雁大,1 顆星,2022年1月26日,要繳貸款却一直跳回登入帳號,中國信託行動銀行 Home Bank,13
28474,行者無疆,1 顆星,2022年4月9日,複雜，難用，毛很多，弄到牙起來,LINE Bank,15
11265,淑慧（melody）,5 顆星,2023年7月6日,系統很順，操作簡單明瞭,富邦行動銀行,11
3524,sh c,3 顆星,2022年3月12日,".""/」」!!、a",國泰世華網路銀行CUBE,9
10220,Ricky Huang,1 顆星,2023年7月15日,怎麼不能夠更新？,富邦行動銀行,8
1776,黃志萍,5 顆星,2022年12月27日,方便好利用節省時間,國泰世華網路銀行CUBE,9
22726,潘海紅,1 顆星,2024年1月2日,強制更新后打不開app,凱基銀行,11
27283,Julian Chen,1 顆星,2023年9月26日,有很大很大的進步空間，加油好嗎,新光銀行,15
11635,Kujc,1 顆星,2023年3月24日,一直loading 是什麼意思,富邦行動銀行,15
8025,Ang Ang,1 顆星,2022年3月16日,無法下載也無法更新......,中國信託行動銀行 Home Bank,15
10006,吳傑克,5 顆星,2023年8月14日,好用方便查詢轉帳,富邦行動銀行,8
9593,Joe Peng,5 顆星,2023年11月27日,介面清楚易懂可靈活設定主劃面,富邦行動銀行,14
6264,Sally Lu,1 顆星,2022年11月9日,一堆用不到的功能,中國信託行動銀行 Home Bank,8
12972,優雅蝶兒,5 顆星,2022年1月6日,易懂好操作，非常好用。,富邦行動銀行,11
10490,黃秋菽,1 顆星,2023年7月15日,更新後完全不能開，一直要更新,富邦行動銀行,14
29414,M Y,5 顆星,2023年4月8日,★我的邀請碼：6BFN7,將來銀行 NEXT BANK,12
689,陳柏志,3 顆星,2023年10月10日,6c9欸欸欸阿瑞斯OOOO,國泰世華網路銀行CUBE,13
16834,陳瑞美,5 顆星,2023年5月14日,很便民，非常滿意,永豐行動銀行,8
18192,E H,1 顆星,2024年1月2日,定存的功能有嗎？,華南銀行+,8
22383,賴婉娟,1 顆星,2021年5月31日,更新後，無法上下移動畫面。,合作金庫銀行,13
12222,歐立容,1 顆星,2022年7月16日,你家軟體真難安裝啊！,富邦行動銀行,10
26236,徐惠蘭,1 顆星,2022年3月2日,也更新太久了，超級差,Richart,10
29425,吳約伯,1 顆星,2023年4月1日,銀行變通效率極低 不建議使用！,將來銀行 NEXT BANK,15
2727,hsun Liu,1 顆星,2022年7月23日,怎麼一直連線異常，重裝也一樣,國泰世華網路銀行CUBE,14
15076,邵聰賢,1 顆星,2021年11月27日,登入太繁雜，為難長輩！！,元大銀行 Yuanta Commercial Bank,12
10055,Joanne Cheng,4 顆星,2023年8月4日,何時才會有指紋登入,富邦行動銀行,9
23999,徐家豪,5 顆星,2022年3月7日,方便。省時的app,台新銀行行動銀行,9
24536,kim潘,1 顆星,2021年12月10日,更新完，完全不能開,台新銀行行動銀行,9
338,吳承羲,1 顆星,2024年1月8日,你們慢慢收你們的手續費去吧,國泰世華網路銀行CUBE,13
17495,呂沅璋,1 顆星,2022年1月9日,到底為什麼破到現在還不能更新,永豐行動銀行,14
13759,陳文正,2 顆星,2021年12月30日,更新之後無法使用！,兆豐銀行,9
28523,游亘德,5 顆星,2022年3月21日,還是希望能比照一般銀行功能,LINE Bank,13
1608,Hoo Ran,5 顆星,2023年1月26日,最簡單易懂的銀行app,國泰世華網路銀行CUBE,11
25781,gou zhang,1 顆星,2022年9月29日,强迫更新才能使用,Richart,8
4024,鄭婷文,5 顆星,2022年1月11日,方便，設定也很簡單,國泰世華網路銀行CUBE,9
20233,Natsuki Irie,5 顆星,2023年5月27日,好用 好人性的介面,玉山行動銀行,9
25655,李麗萍,2 顆星,2022年12月22日,按下分享我的帳號會閃退,Richart,11
6821,C A,5 顆星,2022年7月26日,很好用e銀行，我喜歡,中國信託行動銀行 Home Bank,10
13218,Xiao Chun Hsieh,5 顆星,2021年11月6日,Excellent,富邦行動銀行,9
30889,珞櫻羽（櫻）,5 顆星,2023年1月8日,希望增加入帳通知,臺灣銀行-網路銀行隨身版,8
19960,Karen Lin,5 顆星,2023年7月14日,很淺顯易懂操作方式,玉山行動銀行,9
15006,陳妤,1 顆星,2021年12月13日,更新的老半天，怎麼股市下單啦,元大銀行 Yuanta Commercial Bank,14
29021,賴品菘,5 顆星,2023年7月31日,很貼切的銀行程式服務,DBS digibank TW 星展行動銀行,10
492,Phoenix Lin 林育德,5 顆星,2023年12月8日,不能轉帳，更新無用。>_<,國泰世華網路銀行CUBE,13
13834,顏dewinds,1 顆星,2021年10月30日,信用卡功能回來再補,兆豐銀行,9
11524,Chenyu LI,5 顆星,2023年4月24日,剛開始用，感覺不錯,富邦行動銀行,9
2305,魏廷峰,1 顆星,2022年10月8日,無法登入，卡在新版畫面,國泰世華網路銀行CUBE,11
11301,林鳳英,5 顆星,2023年6月30日,太強了啦~感謝~,富邦行動銀行,8
10721,黃俊凱,1 顆星,2023年7月15日,下載後無法打開使用,富邦行動銀行,9
29226,李炳億,5 顆星,2021年1月7日,好棒，app軟體，超好用。,DBS digibank TW 星展行動銀行,13
12925,崔姿亭,5 顆星,2022年1月14日,使用方便，非常好👍👍👍,富邦行動銀行,11
18384,王奇蹟,4 顆星,2023年8月19日,煩死了 每個軟體都要我更新,華南銀行+,13
31085,王祥,1 顆星,2022年6月16日,一直顯示系統維修 登不進去,臺灣銀行-網路銀行隨身版,13
2641,賴永文,5 顆星,2022年8月2日,操作方便，使用安全,國泰世華網路銀行CUBE,9
6231,Guo-Siou Chen,5 顆星,2022年11月14日,操作直覺明快 有必要的保密措施,中國信託行動銀行 Home Bank,15
12248,安安,1 顆星,2022年7月12日,一直登不進去，一直轉圈圈...,富邦行動銀行,15
27169,yang艾琳,1 顆星,2023年11月8日,信用卡功能依然無法使用,新光銀行,11
14765,ian Chang,3 顆星,2022年5月22日,突然無法下載安裝了？！,元大銀行 Yuanta Commercial Bank,11
13640,J H,2 顆星,2022年4月28日,有感受到預約轉帳功能的優化,兆豐銀行,13
22765,林揚荃,5 顆星,2023年12月6日,簡潔明瞭 很好用,凱基銀行,8
10587,姜宇暉,1 顆星,2023年7月15日,更新也打不開啊怎麼更新,富邦行動銀行,11
17860,Wilhelmina Yu,4 顆星,2024年3月26日,剛開始用，還不知道好用不好用,華南銀行+,14
11741,Grace Kuo,5 顆星,2023年2月2日,快速完成，很好！,富邦行動銀行,8
23022,謝慧美,2 顆星,2022年11月2日,不直觀，比舊版難用很多,凱基銀行,11
18953,Christ Arrow,1 顆星,2022年8月22日,新舊系統都慢死了，一直跑圈圈,華南銀行+,14
17206,廖美琪,1 顆星,2022年11月29日,更新完。卻無法登入,永豐行動銀行,9
5085,生活藝術家阿翔,1 顆星,2023年9月1日,手續費15元 我受不了,中國信託行動銀行 Home Bank,11
16558,蕭仁德,5 顆星,2023年10月2日,感謝，非常好用的APP,永豐行動銀行,11
30318,林威劉,1 顆星,2023年3月22日,開個戶到拍照一直跳出來,樂天國際商業銀行,11
28067,Li-Min Huang,1 顆星,2023年6月2日,App一直轉圈圈都不能登入,LINE Bank,13
7410,Chunhsi Li,1 顆星,2022年4月25日,更新後App檢查速度超慢,中國信託行動銀行 Home Bank,12
3463,danny YANG,1 顆星,2022年3月26日,更新後資料都不見rrr,國泰世華網路銀行CUBE,11
23995,翁順得,1 顆星,2022年3月11日,根本下載不來。。。。。,台新銀行行動銀行,11
29069,昱呈林,1 顆星,2022年9月6日,我剛進來就被強制退出來,DBS digibank TW 星展行動銀行,11
9419,10938vic,5 顆星,2024年1月20日,查詢方便有效率。,富邦行動銀行,8
9349,Alex Co,2 顆星,2024年2月13日,轉賬簡訊都收不到，很離譜,富邦行動銀行,12
18558,瑋姈,1 顆星,2023年1月30日,更新後變不能登入,華南銀行+,8
18841,Rose FCH,1 顆星,2022年9月26日,轉帳不好用啦 有看沒有懂,華南銀行+,12
27849,Tsun-Iu Kua,2 顆星,2024年4月5日,無法查詢一年以上的交易紀錄,LINE Bank,13
7387,Anita CV,3 顆星,2022年4月25日,更新後很當餒~早知道不更新了,中國信託行動銀行 Home Bank,14
6956,潘定珊,2 顆星,2022年7月1日,新的程式太複雜不易找,中國信託行動銀行 Home Bank,10
21653,鐵生丁,5 顆星,2021年10月14日,服務人員當場指導很親切！,玉山行動銀行,12
6312,哈雷路亞,5 顆星,2022年11月1日,手機轉查帳好用~,中國信託行動銀行 Home Bank,8
14177,看錯快速看錯無,5 顆星,2023年12月18日,元大银行台北富邦银行功能上网,元大銀行 Yuanta Commercial Bank,14
22286,Ann,1 顆星,2021年9月8日,轉圈圈轉了5分鐘都登不進去,合作金庫銀行,13
12038,鄧幼涵,5 顆星,2022年9月5日,好用，邏輯清楚，使用起來很順手,富邦行動銀行,15
11465,catherine huang,5 顆星,2023年5月8日,精簡好用，速度亦佳。,富邦行動銀行,10
22157,Snoopy Snoopy,5 顆星,2022年4月16日,我需要的功能都很好用 連線快速,合作金庫銀行,15
17477,蔡佳慧,3 顆星,2022年1月20日,講了快一年了還是沒有出入帳通知,永豐行動銀行,15
11697,Himizu Chen,1 顆星,2023年2月22日,line每天2則提醒煩不煩,富邦行動銀行,13
11860,酈美華,5 顆星,2022年12月6日,繳停車費還有折扣真讚,富邦行動銀行,10
4267,andy仔,1 顆星,2024年4月4日,還是無法登入，嘗試很多變了,中國信託行動銀行 Home Bank,13
12368,王文宗,4 顆星,2022年6月11日,app好像進不去,富邦行動銀行,8
6979,wan li she,1 顆星,2022年6月26日,超慢無法登入網銀,中國信託行動銀行 Home Bank,8
22553,啊嘎,1 顆星,2020年10月5日,網路連線代碼是什麼,合作金庫銀行,9
2354,HOCC ETHAN,5 顆星,2022年9月30日,好用，使用起來很順。,國泰世華網路銀行CUBE,10
31218,潘宣佑,1 顆星,2022年5月19日,這次更新後完全不能登錄,臺灣銀行-網路銀行隨身版,11
222,黃燄天,1 顆星,2024年2月6日,一直閃退開不起來,國泰世華網路銀行CUBE,8
17729,H Hunter,5 顆星,2021年8月9日,指示很清楚問題解決了，很棒。,永豐行動銀行,14
24522,顧惟淵,1 顆星,2021年12月10日,突然間就登不進去了,台新銀行行動銀行,9
4682,林美鳳,3 顆星,2023年12月16日,感覺跟之前比退步好多,中國信託行動銀行 Home Bank,10
17327,90,1 顆星,2022年6月3日,超難用 問題超多,永豐行動銀行,8
22226,ye世雄,5 顆星,2022年1月22日,好.服務員.態度好。,合作金庫銀行,10
13573,_ Telsey,5 顆星,2022年7月31日,目前使用起來很便利,兆豐銀行,9
3947,Li Erica,2 顆星,2022年1月21日,為什麼不能開啟了？,國泰世華網路銀行CUBE,9
18666,吳秋滿,5 顆星,2022年11月30日,操作方便節省時間。,華南銀行+,9
24625,Chunta Chou,5 顆星,2024年2月29日,方便，簡單，明確,Richart,8
11996,HUANG Rebekah,1 顆星,2022年9月24日,訊息已讀無法刪除,富邦行動銀行,8
2795,許世惠,2 顆星,2022年7月16日,不 太了解 操作,國泰世華網路銀行CUBE,8
18898,wayne wang,1 顆星,2022年9月2日,有夠爛 裝置綁定一直失敗,華南銀行+,12
15276,Hu Marco,4 顆星,2023年8月31日,整體使用中規中矩,第一銀行 第e行動,8
3300,Tim Lin,5 顆星,2022年4月8日,連線異常修復，五星,國泰世華網路銀行CUBE,9
11528,蔡崑明,3 顆星,2023年4月21日,出門永遠不可以。,富邦行動銀行,8
4016,莊振明,5 顆星,2022年1月12日,操作方便節省時間,國泰世華網路銀行CUBE,8
27159,Danny Daga,5 顆星,2023年11月21日,有深色模式就是棒🙏😽✨,新光銀行,11
18488,Rita Jiang,1 顆星,2023年4月22日,開啟後一直無法進入app,華南銀行+,12
13556,陳Eddie,3 顆星,2022年8月5日,無法使用？網路銀行掛了嗎？,兆豐銀行,13
25379,陳無名,1 顆星,2023年7月21日,一直跳出掃碼無法正常登錄!,Richart,13
266,CHIHWEI HUANG,1 顆星,2024年1月25日,更新最新版本，一直閃退是三小,國泰世華網路銀行CUBE,14
7514,Wu Jayaliilá (Jayaliila'),5 顆星,2022年4月14日,conveniente,中國信託行動銀行 Home Bank,11
2828,張博竣,5 顆星,2022年7月9日,已經更新了！還不可以用！,國泰世華網路銀行CUBE,12
18944,Tsai yun chen,5 顆星,2022年8月24日,服務好真誠快速簡易,華南銀行+,9
21671,Jesse,1 顆星,2021年10月11日,無法查刷卡明細，卡的要死,玉山行動銀行,12
19458,陳秋嬌,5 顆星,2023年12月5日,app很方便操作,玉山行動銀行,8
21636,盧之輝,5 顆星,2021年10月17日,Good app,玉山行動銀行,8
8514,劉changchung,1 顆星,2022年3月12日,"軟體打不開,網路銀行無法開啟！",中國信託行動銀行 Home Bank,15
27507,羅文禧,1 顆星,2022年11月2日,完全無法使用，很困擾,新光銀行,10
29370,邱燕玲,1 顆星,2023年6月20日,因為我一整個很生氣了,將來銀行 NEXT BANK,10
29369,BESCHWA CHEN,4 顆星,2023年6月23日,有無卡提款就滿分,將來銀行 NEXT BANK,8
16850,Phil Chen,5 顆星,2023年5月8日,功能人性化，完善。,永豐行動銀行,9
13101,CC Tsai,4 顆星,2021年12月2日,直覺式很好用，真用心,富邦行動銀行,10
26620,Irene lin,5 顆星,2021年11月1日,網路交易超方便也超快速,Richart,11
12227,蕭香香,5 顆星,2022年7月15日,方便丶易懂丶速度快,富邦行動銀行,9
5379,曾夢竹,5 顆星,2023年6月18日,方便快速 優質的,中國信託行動銀行 Home Bank,8
13120,Chien-Hung Liao,5 顆星,2021年12月1日,介面覺得做的還不錯,富邦行動銀行,9
26717,吳晴,1 顆星,2024年2月5日,無法更新，不能使用,新光銀行,9
30805,Isen Wang,4 顆星,2023年6月2日,It sucks,臺灣銀行-網路銀行隨身版,8
23278,黃思思,5 顆星,2023年10月22日,功能很多 操作方便,台新銀行行動銀行,9
24156,李華華,1 顆星,2022年1月23日,根本無法更新，傻眼,台新銀行行動銀行,9
3420,Ricky Chiu,5 顆星,2022年4月1日,方便，便利，好用,國泰世華網路銀行CUBE,8
6754,bobo Pinky,1 顆星,2022年8月7日,為什麼下載後打不開？,中國信託行動銀行 Home Bank,10
30234,吳和昌,5 顆星,2023年6月6日,簡單易操作值得推,樂天國際商業銀行,8
12315,Allen Hsu,5 顆星,2022年7月1日,介面清晰方便使用,富邦行動銀行,8
24781,吉豬豬,1 顆星,2023年12月19日,重新安裝居然無法安裝好奇怪,Richart,13
30619,Chang Yangshin,5 顆星,2021年12月3日,"很方便,功能人性化",樂天國際商業銀行,9
23592,steven chen,1 顆星,2022年10月25日,網銀也是有上下班時間嗎？,台新銀行行動銀行,12
28247,Ives Wu,5 顆星,2022年9月20日,支援Pixel臉部辨識，讚,LINE Bank,13
31198,蔡怡君,1 顆星,2022年5月21日,為什麼都無法更新～太爛了,臺灣銀行-網路銀行隨身版,12
24840,sacha Hsu,1 顆星,2023年12月6日,更新完打開黑屏，完全不能用！！,Richart,15
16844,江淑萍,5 顆星,2023年5月10日,貼心提醒 操作省時快速,永豐行動銀行,11
17310,shu hsun Lee,4 顆星,2022年7月18日,"ok,good work",永豐行動銀行,12
24351,JL Young,1 顆星,2022年1月6日,真的很卡，難用死了。,台新銀行行動銀行,10
20568,Hunnie Chang,1 顆星,2022年9月10日,更新後一直顯示異常耗電,玉山行動銀行,11
2371,shirre chang,3 顆星,2022年9月26日,一使用轉帳立刻當掉,國泰世華網路銀行CUBE,9
25770,鹹魚,1 顆星,2022年10月4日,一天到晚更新是有什麼毛病嗎？,Richart,14
4062,曹昌木,5 顆星,2022年1月5日,安全方便，服務佳。,國泰世華網路銀行CUBE,9
20238,cindy sheu,5 顆星,2023年5月26日,玉山作業，值得信賴。,玉山行動銀行,10
23577,陳見如,1 顆星,2022年11月23日,一直當機，根本沒辦法用,台新銀行行動銀行,11
7749,ANGEL SELENE,1 顆星,2022年3月29日,每次打開速度很慢，也常常卡住。,中國信託行動銀行 Home Bank,15
11002,lin chih,1 顆星,2023年7月14日,小米10 無法更新,富邦行動銀行,9
5040,くしゃみ,2 顆星,2023年9月13日,一直顯示安全元件加載中…進不去,中國信託行動銀行 Home Bank,15
24806,chiachen Tai,1 顆星,2023年12月12日,非常難用，轉很久還完全無法登入,Richart,15
23237,x0519121010,1 顆星,2023年12月25日,一直登不進去....是怎樣,台新銀行行動銀行,13
1277,黃綋恩,5 顆星,2023年4月7日,App運作順暢，介面簡易操作,國泰世華網路銀行CUBE,14
17468,FreshBar新鮮吧,1 顆星,2022年1月27日,一直轉圈圈，無法載,永豐行動銀行,9
5435,黃卿敏,5 顆星,2023年6月5日,介面平台非常好用,中國信託行動銀行 Home Bank,8
7660,茹茹彭,1 顆星,2022年4月1日,一直轉圈圈，跟本無法加入,中國信託行動銀行 Home Bank,12
4235,maggie shih,5 顆星,2021年12月21日,方便。。。好用。。。,國泰世華網路銀行CUBE,10
14065,Hector (廷),1 顆星,2021年7月13日,進不去他說要更新又無法更新,兆豐銀行,13
2380,許一（小仟仟）,5 顆星,2022年9月24日,我覺得權益自由切換很好玩,國泰世華網路銀行CUBE,12
14290,Reynold Dai,2 顆星,2023年3月31日,有夠爛有更新，常常登入不了,元大銀行 Yuanta Commercial Bank,13
107,Moon Leaf,1 顆星,2024年3月4日,非常爛，會閃退無法開啟,國泰世華網路銀行CUBE,11
18516,邱蒼景,5 顆星,2023年3月23日,/很清楚一看就知道OK謝了。,華南銀行+,14
556,羅伊陳,1 顆星,2023年11月22日,軟體閃退，怎麼處理。,國泰世華網路銀行CUBE,10
1731,Lia Yang,1 顆星,2023年1月6日,刪koko轉帳，可惡,國泰世華網路銀行CUBE,10
24985,wang handsome,1 顆星,2023年10月9日,新版app看不到虛擬信用卡卡號,Richart,15
20008,賴paula,5 顆星,2023年6月30日,指紋變認超好用的確認法,玉山行動銀行,11
26017,陳國松,5 顆星,2022年5月11日,我是安卓系統，安裝反而無法使用,Richart,15
30226,WHO GOD,1 顆星,2023年6月29日,"利率高 爛 ,浪費時間",樂天國際商業銀行,11
29785,ISSY Xue,1 顆星,2022年7月5日,神奇的無限網路異常。,將來銀行 NEXT BANK,10
23203,HSIU YU Chi,2 顆星,2024年1月25日,最近更新完後快速登入無法使用,台新銀行行動銀行,14
24857,黃重重,5 顆星,2023年12月3日,功能越來越強大與使用便利！,Richart,13
2356,少君,1 顆星,2022年9月29日,原本畫面簡單明瞭,國泰世華網路銀行CUBE,8
19707,蘇鈺嬿,5 顆星,2023年10月6日,"玉山網路銀行,方便快速又好用",玉山行動銀行,14
9490,jiunhau wang,5 顆星,2024年1月1日,請獨立台幣活存顯示,富邦行動銀行,9
5442,ASC,5 顆星,2023年6月2日,快速方便 安全性高 值得信賴,中國信託行動銀行 Home Bank,14
21813,Yen Hsiao (正彥),1 顆星,2023年10月24日,有夠爛 我要編輯常用帳號無法按,合作金庫銀行,15
5208,sir chen,4 顆星,2023年7月31日,蠻方便的。不出門就可以轉帳,中國信託行動銀行 Home Bank,13
30264,陳品均（阿均）,5 顆星,2023年4月26日,好用，優惠有期限,樂天國際商業銀行,8
16656,Jason Kao,5 顆星,2023年8月4日,免出門，快速又方便,永豐行動銀行,9
11648,邱阿龍,1 顆星,2023年3月19日,什麼爛銀行App非常難用,富邦行動銀行,12
20844,蔡小恩,5 顆星,2022年6月2日,已經可以登入了，謝謝,玉山行動銀行,10
29165,劉小慈,3 顆星,2022年2月22日,各明細不會顯示餘額，覺得不便民,DBS digibank TW 星展行動銀行,15
26263,高琳達（夜貓女神）,5 顆星,2022年2月18日,我是否可以用台幣去悅換外幣鈔票,Richart,15
16146,JAMES LIN,1 顆星,2021年9月11日,更新超久，還死檔機,第一銀行 第e行動,9
10852,hanamichi Sakuraki,1 顆星,2023年7月15日,怎麼不能更新？app也打不開！,富邦行動銀行,15
16313,Eva Shih,1 顆星,2024年2月6日,轉帳金額不能超過1萬？爛,永豐行動銀行,12
15153,丁逢信,5 顆星,2021年10月7日,我無法下載該如何,元大銀行 Yuanta Commercial Bank,8
19949,憶娟,5 顆星,2023年7月18日,好可愛的提示音喔！,玉山行動銀行,9
24632,Lin Toby,5 顆星,2024年2月24日,很棒的Richart 團隊😀,Richart,14
5922,遺忘的時光,5 顆星,2023年1月31日,簡潔 便利 好操作,中國信託行動銀行 Home Bank,9
1278,武名麗,5 顆星,2023年4月7日,讓生活更多方便的好銀行,國泰世華網路銀行CUBE,11
24738,Ann Wu,5 顆星,2024年1月6日,介面可愛好用，很推薦的app,Richart,14
3332,中島真一,1 顆星,2022年4月5日,無法登入 系統偵測有問題,國泰世華網路銀行CUBE,12
11131,點點杏,1 顆星,2023年7月14日,請問這次怎麼更新阿一直沒辦法用,富邦行動銀行,15
3408,Quant Jock,1 顆星,2022年4月5日,常常顯示連線異常無法進入程序,國泰世華網路銀行CUBE,14
5640,黃素蘭,5 顆星,2023年4月12日,快速順暢，舒心。,中國信託行動銀行 Home Bank,8
20442,謝建成,2 顆星,2022年11月18日,敢做敢當=消費者天下,玉山行動銀行,10
1140,Google 使用者,1 顆星,2023年5月16日,帳戶服務都進不去，爛APP，,國泰世華網路銀行CUBE,14
19787,簡小玉,5 顆星,2023年9月18日,"界面設計容易操作,真的很棒。",玉山行動銀行,14
26587,Lin Eric,5 顆星,2021年11月11日,很好用 蠻便利的，也很人性化,Richart,14
12873,Kevin Lin,5 顆星,2022年2月5日,愈來愈順了 讚！,富邦行動銀行,8
10751,Every Day,1 顆星,2023年7月15日,根本無法自動更新,富邦行動銀行,8
18784,何緯慈,4 顆星,2022年10月12日,App 活存轉定存位置找不到,華南銀行+,14
11534,Mana L,1 顆星,2023年4月19日,不管電話打多久，就是沒客服,富邦行動銀行,13
20156,李梓菱,3 顆星,2023年6月2日,無法截圖，很不方便,玉山行動銀行,9
6326,咪咪喵,5 顆星,2022年10月30日,很方便，很喜歡...常常在使用,中國信託行動銀行 Home Bank,15
24107,林昭同,1 顆星,2022年1月28日,很爛 為何要強迫更新,台新銀行行動銀行,10
29825,周文欽,5 顆星,2022年6月17日,verygood,將來銀行 NEXT BANK,8
18773,wind ww,1 顆星,2022年10月15日,更新後記憶手勢不能用了。,華南銀行+,12
12293,Puggy Yu,2 顆星,2022年7月4日,介面真的是很難用又登不進去==,富邦行動銀行,15
6139,Lin Maxwell,1 顆星,2022年12月4日,希望有無手續費服務,中國信託行動銀行 Home Bank,9
12325,蔡阿倫,1 顆星,2022年6月29日,缺少收款自動連結的功能,富邦行動銀行,11
7968,車喔喔看呃呃,1 顆星,2022年3月17日,煩死了整天更新佔容量,中國信託行動銀行 Home Bank,10
18229,廖家筠,2 顆星,2023年12月30日,台幣定存無法使用非常不方便,華南銀行+,13
4629,WEI-JIE Jhou,5 顆星,2024年1月4日,速度快，還滿方便的,中國信託行動銀行 Home Bank,9
19443,曾楠晶,1 顆星,2023年12月9日,每個月沒有免手續費的轉賬。,玉山行動銀行,13
14257,winds,1 顆星,2023年7月7日,除了爛之外 就沒其他優點了,元大銀行 Yuanta Commercial Bank,13
29121,Charles Weng,5 顆星,2022年2月24日,希望持續更新，優化使用者體驗。,DBS digibank TW 星展行動銀行,15
28397,吳今晨,5 顆星,2022年6月7日,我的華為手機好像壞掉了,LINE Bank,11
20371,王琇玲,5 顆星,2023年2月14日,我覺得非常好 我很喜歡,玉山行動銀行,11
3470,Lin Hsiang Yi,5 顆星,2022年3月25日,介面還算清楚，沒有多餘廣告來亂,國泰世華網路銀行CUBE,15
18702,christina chih,5 顆星,2022年11月16日,資料很清楚，很好用。,華南銀行+,10
25650,Duncan Hang,1 顆星,2022年12月28日,越更新越爛，然後舊戶活存一堆毛,Richart,15
