index,name,score,dtm,text,app_name,text_length
20731,孟慈,1 顆星,2022年8月2日,連線風險 怎麼弄都不行,玉山行動銀行,11
19739,陳思元,5 顆星,2023年10月1日,介面使用清楚順暢,玉山行動銀行,8
1452,ching政沁,1 顆星,2023年2月24日,如何如同koko一樣記帳,國泰世華網路銀行CUBE,12
17681,SHER貓咪,1 顆星,2021年10月3日,無法登入，畫面一直重複,永豐行動銀行,11
25992,陳俊卿,5 顆星,2022年5月20日,為什麼手機沒辦法下載呢？,Richart,12
19593,Arago Wang,5 顆星,2023年10月30日,使用流暢便利，棒！,玉山行動銀行,9
20485,jerry liao,1 顆星,2022年10月13日,已經限制背景，還是耗電第一名,玉山行動銀行,14
5269,Eva Hui,5 顆星,2023年7月17日,新版轉帳字體格式清晰,中國信託行動銀行 Home Bank,10
19929,楊東霖,5 顆星,2023年7月26日,介面簡單，使用方便,玉山行動銀行,9
3742,陳映蓁,4 顆星,2022年2月20日,解決我上銀行的困擾！太方便了！,國泰世華網路銀行CUBE,15
1602,Jonathan Chen,5 顆星,2023年1月27日,界面親切好用，版面潔淨清晰。,國泰世華網路銀行CUBE,14
28766,阿翔Vlog,3 顆星,2021年11月15日,什麼時後會開啟臉部辨識,LINE Bank,11
23300,ೋღ 臻 ღೋ,2 顆星,2023年9月1日,更新後帳務快覽顯示不見了,台新銀行行動銀行,12
12137,cyj chao,5 顆星,2022年8月3日,app系統 靈活又好用,富邦行動銀行,11
26402,S,1 顆星,2022年1月3日,更新完就不能登入了 到底？,Richart,13
24311,neago lin,1 顆星,2022年1月9日,不能更新該怎麼操作,台新銀行行動銀行,9
5888,陳美樺,5 顆星,2023年2月9日,很方便，但手續費用優惠次數太少,中國信託行動銀行 Home Bank,15
13546,劉浩薇,1 顆星,2022年8月10日,經常更新，等太久。,兆豐銀行,9
20960,Chung A,1 顆星,2022年4月14日,無法進入，系統不相容???,玉山行動銀行,13
2532,李銘祐,2 顆星,2022年8月24日,今天點不進去一顆樹,國泰世華網路銀行CUBE,9
1371,Jessica Chang,5 顆星,2023年3月15日,帳戶安全，迅速方便，非常好用,國泰世華網路銀行CUBE,14
8210,Jennifer Wu,5 顆星,2022年3月13日,順暢好用的網銀app,中國信託行動銀行 Home Bank,10
15624,鈺婷曾,5 顆星,2022年5月3日,簡單方便，好操作，簡易上手,第一銀行 第e行動,13
5150,Ming Hui Hish,3 顆星,2023年8月15日,每月免費轉帳要多一些,中國信託行動銀行 Home Bank,10
20128,品均,5 顆星,2023年6月5日,用過最好用的銀行app,玉山行動銀行,11
14275,JJH,5 顆星,2023年4月28日,可以正常使用了，謝謝,元大銀行 Yuanta Commercial Bank,10
7311,Stephen Chiu,5 顆星,2022年5月5日,查詢轉帳很方便使用,中國信託行動銀行 Home Bank,9
11333,王德群,5 顆星,2023年6月16日,簡單明瞭好用到不行,富邦行動銀行,9
10871,黃議弘,2 顆星,2023年7月14日,要求更新又不給更新,富邦行動銀行,9
19664,POPcornboy Chung,5 顆星,2023年10月15日,介面 簡單。容易上手👏,玉山行動銀行,11
6211,TR Liao,3 顆星,2022年11月18日,帳號密碼輸入速度太慢,中國信託行動銀行 Home Bank,10
15329,王騰毅,5 顆星,2023年4月7日,一直出現S010到底是怎樣？,第一銀行 第e行動,14
2484,周士耘,5 顆星,2022年9月3日,畫面簡潔明瞭、操作簡單容易！,國泰世華網路銀行CUBE,14
8312,沈小玉,1 顆星,2022年3月12日,叫人更新，但又不給更，是怎樣,中國信託行動銀行 Home Bank,14
4253,張玉英,1 顆星,2021年12月20日,更新等了10分鐘都還無法開啟,國泰世華網路銀行CUBE,14
6578,Meng li Wang,3 顆星,2022年9月12日,舊版的app比較好用,中國信託行動銀行 Home Bank,10
21187,王文忠,4 顆星,2022年3月5日,感謝您的解說。已解決問題。,玉山行動銀行,13
16615,一縷墨,1 顆星,2023年8月31日,找個真人客服真難,永豐行動銀行,8
27183,Adsl,1 顆星,2023年10月30日,爛透了，一大堆頁面，工程師檢討,新光銀行,15
30723,柳志宏,5 顆星,2023年11月1日,簡單明瞭容易操作,臺灣銀行-網路銀行隨身版,8
1610,Howard Chen,5 顆星,2023年1月24日,方便好用 功能簡潔明確易懂,國泰世華網路銀行CUBE,13
26535,黃博緯,1 顆星,2021年11月23日,強迫更新才能登入，希望能夠改掉,Richart,15
20736,莊阿呆（sa900702）,1 顆星,2022年8月1日,連線風險？怎麼解決？,玉山行動銀行,10
24218,cc c,1 顆星,2022年1月20日,不懂再改什麼?介面越改越難用,台新銀行行動銀行,14
30359,芒果青,5 顆星,2022年12月22日,利率很優惠，使用很方便,樂天國際商業銀行,11
17959,shuan,5 顆星,2024年2月11日,介面操作簡單快速,華南銀行+,8
29007,李金龍,1 顆星,2023年8月10日,每次更新密碼就變錯誤,DBS digibank TW 星展行動銀行,10
21741,MM M,1 顆星,2024年1月15日,同步更新卡30%不動,合作金庫銀行,10
24211,郭禹茜,5 顆星,2022年1月20日,好理解，但可否別一直更新,台新銀行行動銀行,12
27250,恒嘉許,1 顆星,2023年10月3日,怎麼沒辦法下載往來明細pdf,新光銀行,14
845,Hakuna Matata,1 顆星,2023年8月17日,動不動就掛，爛死了,國泰世華網路銀行CUBE,9
28419,Jinlong Xu,5 顆星,2022年5月19日,身份證照相片，照了。會當，,LINE Bank,13
4038,李東頴,1 顆星,2022年1月7日,連不上 無法更新,國泰世華網路銀行CUBE,8
7206,白落緋英,3 顆星,2022年5月23日,更新後無法找到新的明細,中國信託行動銀行 Home Bank,11
20865,江必有其益（江緞 江必有其益）,5 顆星,2022年5月17日,操作介面設計很棒喔！,玉山行動銀行,10
7572,蔡正民,3 顆星,2022年4月9日,新版本版面沒有比舊版本版面好,中國信託行動銀行 Home Bank,14
22073,月月,1 顆星,2022年7月15日,永遠看不懂的信用卡詳細記錄,合作金庫銀行,13
13986,林展志,5 顆星,2021年8月4日,good jobs,兆豐銀行,9
11802,B C,5 顆星,2023年1月3日,給5星，操作界面非常好,富邦行動銀行,11
5345,仲兪樂,5 顆星,2023年7月2日,好用。，嚴防個人資料法。,中國信託行動銀行 Home Bank,12
13991,陳永隆,5 顆星,2021年8月1日,"功能齊全,操作簡單便利",兆豐銀行,11
15842,施明憲,1 顆星,2022年1月5日,無法更新，一直轉圈圈,第一銀行 第e行動,10
19829,黑咖啡,1 顆星,2023年8月22日,信箱變更非常不方便,玉山行動銀行,9
10323,Rong,2 顆星,2023年7月15日,更新了。重開機n次都進不去,富邦行動銀行,13
20944,藍素綉,1 顆星,2022年4月18日,太不便民了，到現在進不去,玉山行動銀行,12
30060,Allen Wang,4 顆星,2022年3月29日,邀請碼 EXVTR,將來銀行 NEXT BANK,9
6930,la Da,1 顆星,2022年7月5日,系統登入很卡，拜託請優化,中國信託行動銀行 Home Bank,12
7663,Catherine Lee,1 顆星,2022年4月1日,更新後超當，為何?,中國信託行動銀行 Home Bank,9
15622,Ting Ting,1 顆星,2022年5月5日,真的是難用到不行 有夠爛,第一銀行 第e行動,12
31161,蘇敬庭,1 顆星,2022年5月27日,強迫更新 更新完就打不開...,臺灣銀行-網路銀行隨身版,15
8294,哲信張,3 顆星,2022年3月12日,一直要更新 但是又進不去,中國信託行動銀行 Home Bank,12
20826,黃新庭,1 顆星,2022年6月22日,到底要綁幾次啦，真擾人,玉山行動銀行,11
13852,桃園精品組王莉焄,1 顆星,2021年10月23日,匯款備註一直變亂碼,兆豐銀行,9
15867,林佑真,1 顆星,2022年1月3日,等待超久，沒辦法更新🤔,第一銀行 第e行動,11
12627,林小熊,5 顆星,2022年4月6日,好用！快速！值得推薦！,富邦行動銀行,11
22994,顏淑怡,3 顆星,2022年11月5日,如何移除凱基行動銀行app,凱基銀行,13
27842,曾寬仁,5 顆星,2021年11月11日,資料訊息取得便利,新光銀行,8
233,何勇慶,1 顆星,2024年2月4日,爛死了，一天到晚閃退,國泰世華網路銀行CUBE,10
522,阮文和,5 顆星,2023年12月1日,銀行服務員親切有禮按讚,國泰世華網路銀行CUBE,11
26861,Belle Lu,5 顆星,2023年11月26日,我喜歡新的轉帳功能,新光銀行,9
15499,吳宜婷,1 顆星,2022年8月19日,很有問題的app,第一銀行 第e行動,8
17030,Kurt Lim,5 顆星,2023年2月28日,常用賬號功能方便好用。,永豐行動銀行,11
22171,Huang Amanda,1 顆星,2022年4月11日,更新後一直無法登入,合作金庫銀行,9
8662,游鎮瑋,5 顆星,2022年3月5日,很實用的中信app,中國信託行動銀行 Home Bank,9
2849,邱彰,5 顆星,2022年7月6日,國泰世華銀行棒棒棒讚讚,國泰世華網路銀行CUBE,11
4918,謝榮鴻,5 顆星,2023年10月22日,fabulous,中國信託行動銀行 Home Bank,8
29909,J先生,1 顆星,2022年4月21日,號稱30分鐘，實際不止,將來銀行 NEXT BANK,11
14923,morris YEH (morrisya),1 顆星,2022年2月18日,登不上一直在維修,元大銀行 Yuanta Commercial Bank,8
3406,高慈敏,1 顆星,2022年4月5日,更新後打不開...,國泰世華網路銀行CUBE,9
5181,Emily Chung,4 顆星,2023年8月7日,轉帳銀行代碼沒有928可以選,中國信託行動銀行 Home Bank,14
14698,李柏宗,1 顆星,2022年7月13日,無法使用app請修正更新,元大銀行 Yuanta Commercial Bank,12
20273,A Man,2 顆星,2023年4月28日,一直進不去是怎樣？,玉山行動銀行,9
11924,Lai Tyrael,5 顆星,2022年11月4日,超棒的體驗！感謝工程師們的努力,富邦行動銀行,15
5471,王仁駿,1 顆星,2023年5月27日,LINE 都給你放廣告就好了。,中國信託行動銀行 Home Bank,15
15943,Ben Chi,5 顆星,2021年12月29日,很方便使用，節省滿多時間的 。,第一銀行 第e行動,15
21737,Henry Chen,2 顆星,2024年1月15日,更新同步停在30%,合作金庫銀行,9
29519,diya,1 顆星,2023年1月1日,下載完打不開....,將來銀行 NEXT BANK,10
12928,tanya ku,5 顆星,2022年1月13日,方便明瞭帳戶明細,富邦行動銀行,8
12533,Samuel Huang,5 顆星,2022年5月1日,功能豐富、易操作、穩定。,富邦行動銀行,12
18071,王小花,3 顆星,2024年1月14日,畫面跳轉都轉圈圈,華南銀行+,8
18480,巫聰頡,5 顆星,2023年4月30日,轉帳沒辦法截圖了能否修正,華南銀行+,12
24532,夏雨詩,2 顆星,2021年12月10日,最近時不時在維修？？？,台新銀行行動銀行,11
11841,黃佳雯,5 顆星,2022年12月15日,使用起來很順，不會難操作,富邦行動銀行,12
7326,林奕臻,2 顆星,2022年5月3日,變更介面有點複雜,中國信託行動銀行 Home Bank,8
8971,蕭淑燕,1 顆星,2022年1月10日,為什麼不能下載軟體呢？,中國信託行動銀行 Home Bank,11
20693,kirin kirin,1 顆星,2022年8月9日,更新後 反而進不去了,玉山行動銀行,10
8435,陳浿圻,1 顆星,2022年3月12日,又進不去了還一直叫我更新,中國信託行動銀行 Home Bank,12
17063,andy chen,2 顆星,2023年1月18日,同時間永豐網銀很慢，他家正常,永豐行動銀行,14
25086,小善存,1 顆星,2023年8月25日,越改越差......,Richart,10
3959,Fanny Wu,5 顆星,2022年1月21日,app介面設計使用上易懂流暢,國泰世華網路銀行CUBE,14
14877,老屁孩,1 顆星,2022年3月1日,一直無法登入，是怎樣！！！,元大銀行 Yuanta Commercial Bank,13
19605,Juyu Wang,5 顆星,2023年10月27日,方便使用，感恩🙏,玉山行動銀行,8
14743,boyce HU,1 顆星,2022年6月20日,更新後一直等在更新畫面上,元大銀行 Yuanta Commercial Bank,12
7842,黃曉明,2 顆星,2022年3月23日,功能欄變得好鬆散不好用😂,中國信託行動銀行 Home Bank,12
20307,Gabriel Ji,1 顆星,2023年4月11日,違反下載安裝 安裝進度不會跑,玉山行動銀行,14
21729,Woody Wu,1 顆星,2024年1月27日,App還跳出到其他網頁,合作金庫銀行,11
7049,曾永琳,1 顆星,2022年6月18日,等一個更新等了30分鐘…,中國信託行動銀行 Home Bank,12
8101,Peng Fabienne,2 顆星,2022年3月15日,每次強迫更新都要跑很久....,中國信託行動銀行 Home Bank,15
23899,ALi Pan,1 顆星,2022年4月11日,每次時不時都系統當機，不給登入,台新銀行行動銀行,15
16917,林煒晴,5 顆星,2023年4月12日,轉帳沒有可以掃QR功能,永豐行動銀行,11
25969,錢芳子,1 顆星,2022年6月3日,顯示需更新，但完全無法更新,Richart,13
13790,Kuan-Lin Chen,3 顆星,2021年12月7日,Pixel登入閃退,兆豐銀行,9
8916,Sarah Sung,1 顆星,2022年1月14日,要求更新又不給更新…心很累,中國信託行動銀行 Home Bank,13
16730,tzyy wei Kau,5 顆星,2023年7月2日,簡便安全服務一級棒,永豐行動銀行,9
7068,世㓐,1 顆星,2022年6月16日,爛！連轉帳都無法轉...刪,中國信託行動銀行 Home Bank,13
4805,范瑞達,1 顆星,2023年11月15日,為何一直無法更新,中國信託行動銀行 Home Bank,8
12751,ABBA GUO,5 顆星,2022年3月4日,Friendly,富邦行動銀行,8
27741,KUN YU Li,1 顆星,2022年6月6日,常常更新完就要重新登入,新光銀行,11
16226,瘋麒麟,1 顆星,2024年3月26日,3不5時就更新 ，爛死了,永豐行動銀行,12
30049,Pei-Hua Lo,5 顆星,2022年3月30日,3/30開戶，一切正常,將來銀行 NEXT BANK,11
27790,莊明康,5 顆星,2022年3月1日,感覺很便利，不用臨櫃排隊,新光銀行,12
12132,sl y,5 顆星,2022年8月4日,很好操作，容易上手,富邦行動銀行,9
21147,許瑞芬,1 顆星,2022年3月22日,常當機，卡住，無畫面，超難用,玉山行動銀行,14
7644,Sandy Chen,5 顆星,2022年4月3日,是不是取消一次轉帳免手續費呀。,中國信託行動銀行 Home Bank,15
27863,秋城,3 顆星,2024年3月11日,是好用可是需要錢而已,LINE Bank,10
11812,張玉順,5 顆星,2023年1月2日,網路轉帳美金很方便,富邦行動銀行,9
29364,ʙʀᴇɴᴛ ʟɪᴜ,4 顆星,2023年7月4日,順暢有餘，功能過度陽春，請加油,將來銀行 NEXT BANK,15
21821,Ting Fan,1 顆星,2023年10月13日,爛又不可用開了現在不可用収尋,合作金庫銀行,14
9865,Ziva Chen,1 顆星,2023年9月20日,為什麼這麼慢...,富邦行動銀行,9
13576,蔡尚華,1 顆星,2022年7月29日,每次要更新，無法更新,兆豐銀行,10
11218,陳億馨,1 顆星,2023年7月14日,一直叫我更新 更新了也沒用,富邦行動銀行,13
11721,苗一靈,5 顆星,2023年2月9日,使用便利快捷，很好,富邦行動銀行,9
20604,リーズシャルテアティスマータ,5 顆星,2022年9月2日,Bug修好了給5星,玉山行動銀行,9
1575,陳麗雅,1 顆星,2023年1月31日,很爛，系統可以整合一下嗎？,國泰世華網路銀行CUBE,13
17556,Cindy Lee,1 顆星,2021年11月25日,更新等了10分鐘也沒好……,永豐行動銀行,13
10974,陳魯蛋,2 顆星,2023年7月14日,不能更新 app也不能打開,富邦行動銀行,13
21940,Alisa W,1 顆星,2023年3月25日,目前用過最難用的網銀，很不方便,合作金庫銀行,15
26372,幸福惡魔小愛,1 顆星,2022年1月10日,登不進去，每陣子就來一次,Richart,12
14351,毛金戀,1 顆星,2023年1月17日,外幣無法交易，很難用,元大銀行 Yuanta Commercial Bank,10
17183,莊俊輝,5 顆星,2022年12月30日,很方便，希望以後也一直很安全,永豐行動銀行,14
16020,劉秩菁,1 顆星,2021年10月8日,真是令人印象深刻,第一銀行 第e行動,8
1675,Jeh Lin,1 顆星,2023年1月13日,昨天就一直閃退 發生什麼問題？,國泰世華網路銀行CUBE,15
4920,張仕賢,5 顆星,2023年10月21日,Good App,中國信託行動銀行 Home Bank,8
9476,詹靜宜,5 顆星,2024年1月3日,方便操作，迅速有效率,富邦行動銀行,10
12323,呂慧儀,5 顆星,2022年6月29日,清楚！好用！謝謝 ❣,富邦行動銀行,10
17076,Chia Huang,5 顆星,2023年1月8日,使用方便簡單快速,永豐行動銀行,8
30640,leanne lea,5 顆星,2021年11月4日,網銀又加電子支付 很便利,樂天國際商業銀行,12
10667,劉騰隆,3 顆星,2023年7月15日,請問怎麼無法更新,富邦行動銀行,8
22219,雅雅,1 顆星,2022年2月1日,已經開起入帳通知一樣沒有顯示,合作金庫銀行,14
28291,陳家珍,5 顆星,2022年8月17日,程式好用 超級棒,LINE Bank,8
13110,張小瑄,5 顆星,2021年12月2日,好用 很方便 很感謝,富邦行動銀行,10
20309,Chi Lee,5 顆星,2023年4月9日,有深色模式必須給5星,玉山行動銀行,10
16539,Sasa Chen (小蘋果),5 顆星,2023年10月8日,保密又實用，好幫手,永豐行動銀行,9
1159,張維翰,5 顆星,2023年5月8日,方便又快速好銀行服務,國泰世華網路銀行CUBE,10
28832,ㄚ啦啦,1 顆星,2023年11月12日,轉帳時輸入金額app就崩潰,DBS digibank TW 星展行動銀行,13
17458,Elijah,5 顆星,2022年2月17日,更新～已解決 更評五星,永豐行動銀行,11
25400,慧姻郭,4 顆星,2023年7月2日,真的很好用還有圖片超可愛,Richart,12
25653,Yung-ju Lu,1 顆星,2022年12月26日,不要再維修了 搞什麼阿,Richart,11
293,Chien-Chih Wu,1 顆星,2024年1月18日,一直閃退 到底是什麼意思,國泰世華網路銀行CUBE,12
28063,Rena Chuang,1 顆星,2023年6月11日,驗證碼簡訊要傳好幾年,LINE Bank,10
30578,巫浤銘,5 顆星,2022年2月11日,還不錯用，手機直接操做,樂天國際商業銀行,11
15056,Carrie LAI,1 顆星,2021年12月4日,打開APP是空白的,元大銀行 Yuanta Commercial Bank,9
17704,SEAN,1 顆星,2021年8月21日,無法更新又一直跳通知,永豐行動銀行,10
26422,Holly Huang,5 顆星,2021年12月31日,請問最近app都打不開？,Richart,12
13632,孫佳玲,1 顆星,2022年5月5日,更新完跟本不能進入，無法使用,兆豐銀行,14
24987,盛永泉,5 顆星,2023年10月7日,非常好，非常實用。,Richart,9
11909,蘇柏丞,1 顆星,2022年11月10日,要掛失打個客服一整天都沒人接,富邦行動銀行,14
28167,Kong Mou,1 顆星,2023年2月1日,常常打不開...,LINE Bank,8
15703,潘小虎,5 顆星,2022年3月4日,簡單易懂，好操作。,第一銀行 第e行動,9
11542,鄒守宏,5 顆星,2023年4月15日,使用方便，速度正常，不卡頻,富邦行動銀行,13
12384,范為森,5 顆星,2022年6月8日,算是比較好用的銀行app,富邦行動銀行,12
28540,翁韻純,4 顆星,2022年3月12日,建議約定帳戶新增郵政,LINE Bank,10
5868,張芯悅,5 顆星,2023年2月12日,很好用，很方便喔！,中國信託行動銀行 Home Bank,9
30990,Savoy Lee,1 顆星,2022年8月8日,快速登入何時能用,臺灣銀行-網路銀行隨身版,8
19286,楊謹菲,5 顆星,2024年2月5日,轉帳速度快，服務好。,玉山行動銀行,10
14784,洪誌鴻,1 顆星,2022年4月28日,😏😅🙁🥺😥🤤阿阿姨BBC,元大銀行 Yuanta Commercial Bank,12
25894,閃亮水煮蛋。,4 顆星,2022年7月19日,建議小查罐可以編輯明細,Richart,11
20504,鈴木一郎,1 顆星,2022年10月6日,玉山系統維護中，已經三週了,玉山行動銀行,13
28482,謝小春,5 顆星,2022年4月6日,Excellent,LINE Bank,9
12660,honokiol Tzeng,5 顆星,2022年3月29日,well done,富邦行動銀行,9
19346,yes1987317,5 顆星,2024年1月16日,方便快速又實用，深得我心,玉山行動銀行,12
30559,A AA03,1 顆星,2022年3月20日,"怎麼做都收不到驗證碼,爛死了",樂天國際商業銀行,14
4282,黃柏文,1 顆星,2024年4月4日,目前非常延遲很難操作,中國信託行動銀行 Home Bank,10
11621,許志強,5 顆星,2023年3月31日,訊息明暸，簡易使用，感謝。,富邦行動銀行,13
23023,廖淑君,1 顆星,2022年11月2日,新的一直進不去，就只會轉圈,凱基銀行,13
8870,黑羽疾風,1 顆星,2022年1月21日,一直沒反應，停在讀取畫面,中國信託行動銀行 Home Bank,12
11727,吳佩玉,5 顆星,2023年2月7日,操作friendly,富邦行動銀行,10
23314,Wanderer Mochida,2 顆星,2023年8月21日,無法預約視訊客服,台新銀行行動銀行,8
10183,舒子軒,4 顆星,2023年7月15日,速度快，穩定度還需要再多試試,富邦行動銀行,14
1226,游曜銘,5 顆星,2023年4月18日,設計優良，非常好用的App,國泰世華網路銀行CUBE,13
13123,陳宗鈞,5 顆星,2021年12月1日,All Good,富邦行動銀行,8
27663,鄭香龍,4 顆星,2022年8月26日,尚可滿足需求。 謝謝!,新光銀行,11
29106,Eric Peng,5 顆星,2022年2月28日,介面清楚，簡單好用。,DBS digibank TW 星展行動銀行,10
4751,CHI SHANG CHENG,5 顆星,2023年11月28日,速度很快，就是貴了點,中國信託行動銀行 Home Bank,10
30398,Yanliang L.,5 顆星,2022年11月21日,用幾個月了 無上限優存很厲害,樂天國際商業銀行,14
31066,Daniel CJ Lee,1 顆星,2022年6月28日,一打開就系統維護中，爛,臺灣銀行-網路銀行隨身版,11
27116,Joyce CHEN,5 顆星,2023年11月24日,Very good,新光銀行,9
15873,jack chia,1 顆星,2022年1月3日,爛 ！星送給開發人員,第一銀行 第e行動,10
31379,黃忠墉,5 顆星,2021年10月18日,符合須求，亦即時性高,臺灣銀行-網路銀行隨身版,10
10984,劉哲維,2 顆星,2023年7月14日,就沒有更新一直顯示要更新,富邦行動銀行,12
10747,王sandy,1 顆星,2023年7月15日,無法進入更新...,富邦行動銀行,9
9033,吳明琴,4 顆星,2022年1月8日,會即時通知帳面狀況,中國信託行動銀行 Home Bank,9
28552,李定豐民聖先生,3 顆星,2022年3月6日,登入時要什麼代號～？,LINE Bank,10
2405,李徐明玉,5 顆星,2022年9月20日,便利 銀愛族 感恩,國泰世華網路銀行CUBE,9
16063,Jack Jack,1 顆星,2021年9月22日,無法更新 無法開啟,第一銀行 第e行動,9
7151,朱重福,5 顆星,2022年6月2日,好方便使用的APP,中國信託行動銀行 Home Bank,9
24998,謝宜純,5 顆星,2023年10月3日,介面設計好用、快速便利、讚！,Richart,14
23332,高鈺婷,3 顆星,2023年7月26日,點開app後黑屏,台新銀行行動銀行,8
10982,paul chao,5 顆星,2023年7月14日,很好，非常方便。,富邦行動銀行,8
29399,o誰來版 o,5 顆星,2023年4月27日,★我的邀請碼：FTDH8,將來銀行 NEXT BANK,12
6695,HAN SHENG CHEN,5 顆星,2022年8月19日,功能順暢，滿好用的,中國信託行動銀行 Home Bank,9
27905,堯蕭,1 顆星,2024年1月2日,開個戶 到底要當掉幾次,LINE Bank,11
31216,賴欣柔,2 顆星,2022年5月19日,更新後就不能進去網路銀行了,臺灣銀行-網路銀行隨身版,13
13584,Sandy家蓉,3 顆星,2022年7月25日,操作系統如更簡易會更好,兆豐銀行,11
31235,洪嘉隆,5 顆星,2022年5月14日,問題解決給5顆星,臺灣銀行-網路銀行隨身版,8
21964,Webb Bbb,1 顆星,2023年2月15日,爛app害我轉兩次款,合作金庫銀行,10
1151,小娃,1 顆星,2023年5月11日,轉帳沒有指紋辨識....,國泰世華網路銀行CUBE,12
19747,DEN A,5 顆星,2023年9月29日,操作很好用也方便。,玉山行動銀行,9
4856,玟子,1 顆星,2023年11月6日,APP更新後無法開啟,中國信託行動銀行 Home Bank,10
26650,HSIEH MY,5 顆星,2021年10月20日,介面簡潔明瞭好操作,Richart,9
12147,Kuang Wei Wu,5 顆星,2022年8月1日,很方便掌管的行動銀行APP,富邦行動銀行,13
20215,劉文生,5 顆星,2023年5月29日,服務周到，使用安心,玉山行動銀行,9
27370,神行太保,1 顆星,2023年9月11日,越改越亂很麻煩！,新光銀行,8
23765,王小伊,3 顆星,2022年7月17日,怎麼越更新越難用,台新銀行行動銀行,8
3531,ESG微笑,5 顆星,2022年3月11日,元宇宙＆慎用。很方便,國泰世華網路銀行CUBE,10
22954,彭曲敏,1 顆星,2022年11月10日,一直登不進去，舊版就沒這問題,凱基銀行,14
5263,Jean Chen,1 顆星,2023年7月18日,更新之後，完全連不上，爛透了,中國信託行動銀行 Home Bank,14
26295,周淑玲,5 顆星,2022年2月7日,非常好用的銀行網路程式,Richart,11
2465,鄭凱聲,4 顆星,2022年9月7日,簡單、快速、方便,國泰世華網路銀行CUBE,8
16046,姚智翔,2 顆星,2021年9月25日,請加強小工具5*3太大，謝謝,第一銀行 第e行動,14
846,Li Wen Wang,1 顆星,2023年8月17日,指紋辨識失敗N次常常不能登入,國泰世華網路銀行CUBE,14
16361,何蘇汝,5 顆星,2024年1月7日,服務細心，安全，快速,永豐行動銀行,10
23939,鍾月玲,4 顆星,2022年4月3日,更新等超久，一直沒辦法使用,台新銀行行動銀行,13
20398,王博弘,5 顆星,2023年1月17日,可以臉部辨識好用推薦,玉山行動銀行,10
16397,Leo Kao,1 顆星,2023年12月21日,介面設計 邏輯操作不ok,永豐行動銀行,12
26585,chichi lee,1 顆星,2021年11月12日,app根本進不去,Richart,8
28607,Yu-Kuen Tsai,1 顆星,2022年2月7日,帳務很難理解APP，超不推,LINE Bank,13
8944,劉文龍,4 顆星,2022年1月12日,容易體驗網路銀行的方便跟實用,中國信託行動銀行 Home Bank,14
21572,Eric Kuo,5 顆星,2021年10月28日,操作流暢，使用體驗佳,玉山行動銀行,10
11732,沈碧麗,3 顆星,2023年2月6日,比以前填帳秘-对年長者方便啦,富邦行動銀行,14
28077,Serene Cheng,1 顆星,2023年5月15日,1password不支援,LINE Bank,12
11176,吳寀菻,1 顆星,2023年7月14日,無法開起 一直出現要更新,富邦行動銀行,12
20052,盈慧,5 顆星,2023年6月17日,操作簡便、指示清楚、直覺,玉山行動銀行,12
7820,夏苒,1 顆星,2022年3月24日,更新過後沒有比較好用……,中國信託行動銀行 Home Bank,12
26433,林美伶,2 顆星,2021年12月29日,對老客戶沒啥好優惠,Richart,9
8088,陳宗義,1 顆星,2022年3月15日,一個早上連更新都上不去,中國信託行動銀行 Home Bank,11
11683,鄭琬蓁,1 顆星,2023年3月3日,介面超復古 超難用,富邦行動銀行,9
21005,鄧雅文,1 顆星,2022年4月7日,每次都要一直更新,玉山行動銀行,8
7153,Chiu Wing Chan,5 顆星,2022年6月2日,介面非常友善好用,中國信託行動銀行 Home Bank,8
5841,Flyingmax Nick,3 顆星,2023年2月16日,居然要求安裝其他防護軟體?,中國信託行動銀行 Home Bank,13
